{
  "$schema": "../schemas/marcus.schema.json",
  "id": "marcus",
  "name": "Marcus",
  "role": "Your companion through the ages",
  "fiction_note": "Marcus is an original, timeless fictional counselor inspired by Stoic philosophy. His appearance in this early settlement is a storytelling device, not a historical claim.",
  "future_note": "Divine mandates, temples, unlocked council members and seasonal councils are planned story systems. They do not change this village's rules yet.",
  "ui": {
    "launcher": "Ask Marcus",
    "launcher_hint": "A little counsel, whenever you need it",
    "close": "Return to the village and end online counsel",
    "guide": "Your first steps",
    "conversation": "Talk with Marcus",
    "intro_tag": "A VOICE THROUGH THE AGES",
    "lesson_tag": "LEARN BY DOING",
    "progress": "{number} of {total}",
    "previous": "Back",
    "next": "Continue",
    "begin_guide": "Begin the guide",
    "skip": "Explore on my own",
    "replay": "Replay the opening",
    "restart": "Restart the guide",
    "finish": "Finish the guide",
    "finished": "The next choice is yours",
    "finished_body": "You can return to any lesson, or ask me about the choices in front of you. Take your time: outside a running battle, looking around does not advance the village.",
    "show_me": "Show me this place",
    "active_village_needed": "Begin or resume your village with the existing village controls, then I can show you this lesson's place. Reading this guide creates nothing.",
    "battle_navigation_blocked": "Finish or leave the battle view before following a village lesson. You can still read or ask for counsel here.",
    "chapter_note": "Later lessons describe optional chapters. Read their requirements and choose whether to enable them in the village.",
    "hear": "Ask Marcus about this page",
    "hear_hint": "When connected, ask Marcus to explain the current page with speech and text.",
    "explain_prompt": "Walk me through the current page of my guide. Use the supplied lesson and my visible village situation. Give me one practical next step without taking any actions for me.",
    "connect": "Connect Marcus",
    "disconnect": "Disconnect",
    "mute": "Mute voice",
    "unmute": "Enable voice",
    "connection_note": "Connect to send questions and visible village facts to ElevenLabs. Replies include text and optional speech. Closing Marcus ends the online session. The written guide works offline.",
    "context_note": "Counsel uses a snapshot taken when you ask. Check the village's current costs and forecasts before deciding.",
    "setup_note": "Online counsel needs the private Marcus service configured for this app. You can use every lesson while it is offline.",
    "placeholder": "Ask about your village or the next step…",
    "send": "Ask",
    "you": "You",
    "empty_chat": "A question is a good beginning. Connect when you are ready, then ask me about supplies, building, growth or the choices in front of you.",
    "working": "Marcus is considering your question…",
    "question_too_long": "Please shorten this question to {limit} characters.",
    "ask_supplies": "How do I keep everyone fed?",
    "ask_building": "Why is my building work waiting?",
    "ask_next": "What should I look at next?",
    "reference_mode": "Looking at the reference village",
    "village_mode": "Playing the seasonal village",
    "no_history": "No season has been resolved yet.",
    "no_known_incident": "No discovered incident to discuss.",
    "not_connected": "Connect Marcus to ask a new question. Your guide and this conversation remain available.",
    "lesson_source": "From the village's How to play guide",
    "review_season": "Review the season with Marcus",
    "season_title": "What the season has brought",
    "season_help": "These are the latest resolved season’s reports available to you. Read them here, or connect and ask Marcus about the choices ahead. Reviewing them does not advance time.",
    "season_quiet": "There are no dispatch items to summarize for this season.",
    "season_more": "Further reports are available in Dispatch. This briefing includes a limited selection."
  },
  "status": {
    "unconfigured": "The private service needs its ElevenLabs credentials",
    "disconnected": "Written guide ready",
    "connecting": "Connecting to Marcus…",
    "connected": "Marcus is ready",
    "thinking": "Considering your question…",
    "speaking": "Marcus is speaking",
    "muted": "Voice muted · text stays on",
    "setup_required": "Online counsel is not configured",
    "broker_unavailable": "Marcus's service is unavailable",
    "broker_rejected": "The private service could not authorize this session",
    "agent_private_required": "Marcus must require private authentication in ElevenLabs",
    "rate_limited": "Too many connection attempts. Wait one minute, then reconnect.",
    "service_busy": "Marcus's service is busy. Try connecting again shortly.",
    "connection_failed": "Could not connect to Marcus",
    "connection_timeout": "The connection took too long",
    "unsupported_audio": "Session ended: Marcus's audio format needs configuration. The written guide is available.",
    "protocol_error": "The conversation could not continue",
    "audio_overflow": "Session ended because speech fell behind. Your conversation remains available.",
    "response_timeout": "No answer arrived; try connecting again",
    "idle_timeout": "Session ended after inactivity",
    "agent_busy": "Marcus is finishing an answer",
    "unavailable": "Online counsel is unavailable"
  },
  "intro": [
    {
      "id": "shore",
      "title": "Every great city begins with a hearth",
      "body": "The morning light reaches the shore. There are no marble avenues here, no triumphs carved in stone. There are people, stores of food, timber and the work of another season. Before an empire can endure, a home must endure.",
      "counsel": "I am Marcus. Think of me as a voice carried between ages: a companion to those who must choose, long after any one ruler is gone."
    },
    {
      "id": "mandate",
      "title": "A charge worthy of your attention",
      "body": "In the story we are beginning, the gods will look upon mortal ambition with purposes of their own. For now, your first charge is close enough to touch: keep this community fed, give its people useful work, and build something their children can inherit.",
      "counsel": "A divine vision may reach toward centuries. A wise decision begins with the people who must live through the next season."
    },
    {
      "id": "companion",
      "title": "Ask, examine, then decide",
      "body": "Call on me from the corner of your screen whenever a choice is unclear. We can walk through the village's guide, or you can connect and ask your own questions. My counsel does not spend supplies, issue orders or advance a season. Those decisions remain yours.",
      "counsel": "We shall begin with food, then work, then growth. You may leave the guide at any time and return whenever you wish."
    }
  ],
  "lesson_counsel": [
    "A reserve is time to think. Notice what your chosen buffer asks of the same adults who must also build and gather timber.",
    "Look at what the work costs before admiring what it promises. A commissioned project still needs people and a resolved season.",
    "A willing village does not have an unlimited number of hands. Follow the reason shown for waiting work before ordering more.",
    "Expansion changes the life already here. Look at the ground and the space you will give up, as well as the home you will gain.",
    "Preparation is a choice made before urgency arrives. Inspect the chapter and its costs; you need not adopt it merely because I describe it.",
    "Practice becomes achievement through repeated, useful work. Read the actual requirements instead of chasing a promising title.",
    "An earned title records the past. The support that keeps a town healthy must be sustained in the present.",
    "A service is more than its building. It needs people, maintained stores and enough room in the working life of the town.",
    "Good defense begins with real people and prepared ground. A plan grants neither extra residents nor free equipment.",
    "Choose the manner of command that helps you think clearly. The same battle rules govern personal, delegated and quick command.",
    "The duty of command continues after the encounter. Read what happened, accept the outcome deliberately, and give recovery its share of care."
  ],
  "limits": {
    "question_characters": 1600,
    "conversation_entries": 40,
    "context_projects": 12,
    "context_requests": 24
  }
}
